title,author,genre,rating,price,year,pages,reviews,amazon_year
First 100 Words: A Padded Board Book,Roger Priddy,Vocabulary & Spelling,4.7,3..88,2011,24,"38,701 ratings",2015
The Life-Changing Magic of Tidying Up: The Japanese Art of Decluttering and Organizing,Marie Kondō,"Cleaning, Caretaking & Relocating",4.5,9..42,2017,224,"59,251 ratings",2015
Laugh-Out-Loud Jokes for Kids,Rob Elliott,Humorous,4.6,4..64,2022,128,"12,125 ratings",2015
Secret Garden: An Inky Treasure Hunt and Coloring Book for Adults,Johanna Basford,Use of Color,4.7,10..18,2013,96,"15,936 ratings",2015
StrengthsFinder 2.0,Gallup,Management,4.1,28..52,2007,175,"8,423 ratings",2015
Go Set a Watchman: A Novel,Harper Lee,Cultural Heritage,3.8,12..95,2018,288,"54,069 ratings",2015
"Enchanted Forest: An Inky Quest and Coloring book (Activity Books, Mindfulness and Meditation, Illustrated Floral Prints)",Johanna Basford,Coloring Books,4.8,14..19,2015,84,"8,419 ratings",2015
All the Light We Cannot See,Anthony Doerr,World War II & Holocaust,4.5,12..93,2014,531,"232,435 ratings",2015
The Girl on the Train,Paula Hawkins,Suspense,4.1,12..20,2014,336,"494,411 ratings",2015
Adult Coloring Book: Stress Relieving Patterns,Blue Star Coloring,Use of Color,4.5,9..95,2015,96,"4,363 ratings",2015
Diary of a Wimpy Kid #10: Old School,Jeff Kinney,School,4.7,8..60,2002,224,"33,748 ratings",2015
To Kill a Mockingbird,Harper Lee,Classics,4.7,21..68,1960,384,"141,123 ratings",2015
Adult Coloring Book: Stress Relieving Animal Designs,Blue Star Coloring,Use of Color,4.6,9..95,2021,136,"4,001 ratings",2015
"Adult Coloring Books: A Coloring Book for Adults Featuring Mandalas and Henna Inspired Flowers, Animals, and Paisley Patterns",Coloring Books for Adults,Animals,4.5,8..99,2015,98,"3,203 ratings",2015
Humans of New York : Stories,Brandon Stanton,Cities,4.8,14..24,2015,432,"5,437 ratings",2015
The Martian,Andy Weir,"Mystery, Thriller & Suspense",4.6,8..99,1950,387,"176,360 ratings",2015
"Oh, the Places You'll Go!",Dr. Seuss,Classics,4.9,8..48,1990,56,"52,232 ratings",2015
Knock-Knock Jokes for Kids: Knock-Knock Jokes for Kids (Joke Book & Gift Idea for Children Ages 6-12. Doubles as a Dad Jokes book for Father's Day and Birthdays),Rob Elliott,Questions & Answers,4.5,4..64,2021,128,"6,123 ratings",2015
Dear Zoo: A Lift-the-Flap Book,Rod Campbell,Zoos,4.8,4..84,1725,18,"31,173 ratings",2015
The Day the Crayons Quit,Drew Daywalt,Fiction,4.8,9..50,2013,40,"24,358 ratings",2015
The Boys in the Boat: Nine Americans and Their Epic Quest for Gold at the 1936 Berlin Olympics,Daniel James Brown,State & Local,4.6,10..60,2019,404,"91,163 ratings",2015
"Jesus Calling, Padded Hardcover, with Scripture References: Enjoying Peace in His Presence (A 365-Day Devotional)",Sarah Young,New Testament,4.9,9..09,2004,416,"41,717 ratings",2015
Mindset: The New Psychology of Success,Carol S. Dweck,Personal Finance,4.6,10..65,2021,320,"22,371 ratings",2015
"Grey: Fifty Shades of Grey as Told by Christian (Fifty Shades of Grey Series, 4)",E L James,Contemporary,4.5,12..12,2015,640,"118,522 ratings",2015
Creative Haven Creative Cats Coloring Book (Adult Coloring Books: Pets),Marjorie Sarnat,Use of Color,4.8,6..50,2015,64,"5,290 ratings",2015
How to Win Friends & Influence People (Dale Carnegie Books),Dale Carnegie,Unknown,4.7,9..99,1913,320,"34,768 ratings",2015
The 5 Love Languages: The Secret to Love that Lasts,Gary Chapman,Love & Romance,4.8,7..88,2016,224,"93,996 ratings",2015
Balance (Angie’s Extreme Stress Menders),Angie Grace,Papercrafts,4.6,11..95,2015,103,"2,295 ratings",2015
Creative Haven Owls Coloring Book (Adult Coloring Books: Animals),Marjorie Sarnat,Use of Color,4.7,5..38,2015,64,"5,375 ratings",2015
Thug Kitchen: The Official Cookbook: Eat Like You Give a F*ck (Thug Kitchen Cookbooks),Thug Kitchen,Vegan,4.6,15..89,2014,240,"15,131 ratings",2015
The Great Gatsby: The Only Authorized Edition,F. Scott Fitzgerald,Censorship,4.4,8..41,2004,180,"17,859 ratings",2015
Lost Ocean: An Inky Adventure and Coloring Book for Adults,Johanna Basford,Art,4.7,9..19,2015,80,"8,737 ratings",2015
"The Five Dysfunctions of a Team: A Leadership Fable, 20th Anniversary Edition",Patrick M. Lencioni,Decision-Making & Problem Solving,4.6,9..82,2002,256,"13,786 ratings",2015
The Official SAT Study Guide,The College Board,SAT,4.4,39..22,2004,997,"1,580 ratings",2015
10-Day Green Smoothie Cleanse,JJ Smith,Weight Loss,4.7,9..58,2014,192,"38,364 ratings",2015
The Gifts of Imperfection: Let Go of Who You Think You're Supposed to Be and Embrace Who You Are,Brené Brown,Creativity,4.7,8..71,2019,160,"42,847 ratings",2015
Chicka Chicka Boom Boom (Board Book),Bill Martin Jr.,Beginner Readers,4.9,4..30,2012,36,"40,253 ratings",2015
The Day the Crayons Came Home,Drew Daywalt,Fantasy & Magic,4.8,11..36,2001,48,"6,213 ratings",2015
What If?: Serious Scientific Answers to Absurd Hypothetical Questions,Randall Munroe,Science & Scientists,4.6,14..57,2014,352,"18,595 ratings",2015
Paper Towns,John Green,Friendship,4.2,8..24,2008,305,"35,855 ratings",2015
"Unbroken: A World War II Story of Survival, Resilience, and Redemption",Laura Hillenbrand,Unknown,4.7,9..48,2014,528,"76,515 ratings",2015
Get What's Yours: The Secrets to Maxing Out Your Social Security (The Get What's Yours Series),Laurence J. Kotlikoff,Budgeting & Money Management,4.2,12..12,2015,336,"3,619 ratings",2015
"Magnus Chase and the Gods of Asgard, Book 1: The Sword of Summer",Rick Riordan,Norse,4.6,11..46,2015,512,"24,979 ratings",2015
Dragons Love Tacos,Adam Rubin,"Dragons, Unicorns & Mythical",4.8,9..95,2012,40,"20,113 ratings",2015
Fahrenheit 451,Ray Bradbury,Censorship,4.6,9..05,1953,249,"55,135 ratings",2015
"The Care and Keeping of You: The Body Book for Younger Girls, Revised Edition (American Girl® Wellbeing)",Valorie Schaefer,Personal Hygiene,4.8,12..99,2012,104,"26,974 ratings",2015
Potty (Leslie Patricelli Board Books),Leslie Patricelli,New Experiences,4.7,8..36,2016,28,"14,178 ratings",2015
Thing Explainer: Complicated Stuff in Simple Words,Randall Munroe,Patents & Inventions,4.6,14..89,2015,64,"4,752 ratings",2015
Dead Wake: The Last Crossing of the Lusitania,Erik Larson,History,4.4,14..68,2015,430,"32,971 ratings",2015
The Going To Bed Book,Sandra Boynton,Counting,4.8,3..86,1982,16,"18,895 ratings",2015
"Inspiralized: Turn Vegetables into Healthy, Creative, Satisfying Meals: A Cookbook",Ali Maffucci,Green Housecleaning,4.4,13..27,2015,224,"3,888 ratings",2015
Mystical Mandala Coloring Book (Dover Mandala Coloring Books),Alberta Hutchinson,Coloring Books,4.5,3..99,2007,32,"3,053 ratings",2015
Ultimate Sticker Book: Frozen: More Than 60 Reusable Full-Color Stickers,DK,Girls & Women,4.6,5..88,2013,16,"5,107 ratings",2015
The 20/20 Diet: Turn Your Weight Loss Vision Into Reality,Phil McGraw,Weight Loss,4.0,11..71,2015,338,"9,007 ratings",2015
Night,Elie Wiesel,Holocaust,4.7,7..93,1734,120,"21,793 ratings",2015
What to Expect When You're Expecting,Heidi Eisenberg Murkoff,Pregnancy & Childbirth,4.5,19..76,2008,614,"2,107 ratings",2015
The Jesus Storybook Bible: Every Story Whispers His Name,Sally Lloyd-Jones,Christian,4.9,13..76,2012,352,"13,606 ratings",2015
The Road to Character,David Brooks,Ethics & Morality,4.3,14..78,2015,320,"6,379 ratings",2015
Where Is Baby's Belly Button? A Lift-the-Flap Book,Karen Katz,Anatomy & Physiology,4.8,5..57,2000,14,"14,520 ratings",2015
The Alchemist: A Modern Classic of Magic and Mysticism (Perennial Classics),Paulo Coelho,Historical,4.6,7..85,2014,208,"166,954 ratings",2015
